Surgery ID,Patient ID,Patient Name,Age,Gender,Doctor,Hospital,Surgery Date,Surgery Type,Procedure Name,Anaesthesia Type,Operation Theatre,Start Time,End Time,Duration (mins),Anaesthesiologist,Scrub Nurse,Blood Loss (ml),Complications,Surgery Status,Post Op Notes
SUR-2026-101,P003,Rajan Krishnan,67,Male,Dr. Anitha Rajan,Amrita Hospital Kochi,2026-01-14,Emergency,Percutaneous Coronary Intervention (Angioplasty),Local,OT-3,14:32,16:45,133,Dr. Pradeep Menon,Nurse Latha K,50,None,Successful,Patient shifted to ICU post surgery. Vitals stable.
SUR-2026-102,P006,Anjali Suresh,29,Female,Dr. Meera Pillai,Apollo Hospital Thrissur,2026-01-22,Emergency,Laparoscopic Appendectomy,General,OT-1,09:15,10:40,85,Dr. Santhosh Raj,Nurse Sindhu M,30,None,Successful,Patient recovered well. Discharged after 3 days.
SUR-2026-103,P007,Manoj Kumar,48,Male,Dr. Suresh Babu,KIMS Hospital Trivandrum,2026-02-01,Urgent,Ureteroscopy with Stone Removal,Spinal,OT-2,11:00,12:15,75,Dr. Lakshmi R,Nurse Bindhu T,20,None,Successful,9mm stone successfully removed. Stent placed.
SUR-2026-104,P001,Arjun Nair,45,Male,Dr. Meera Pillai,Apollo Hospital Thrissur,2026-02-10,Elective,Coronary Angiography,Local,OT-3,10:00,11:00,60,Dr. Santhosh Raj,Nurse Latha K,10,None,Successful,No blockage found. Conservative management continued.
SUR-2026-105,P004,Smitha George,54,Female,Dr. Thomas Varghese,Regional Cancer Centre,2026-02-05,Urgent,Lumpectomy Breast,General,OT-4,08:30,10:45,135,Dr. Pradeep Menon,Nurse Sindhu M,80,Minor bleeding controlled,Successful,Tumor margins clear. Chemotherapy to continue.
